{
  "$schema": "https://json-schema.org/draft/2020-12/schema",
  "$id": "https://nuttie.local/schemas/owner-intake.schema.json",
  "title": "Nuttie Owner Intake",
  "type": "object",
  "required": [
    "schemaVersion",
    "batchId",
    "channel",
    "status",
    "updatedAt",
    "acceptanceStateChanged",
    "responses",
    "facts",
    "conflicts",
    "nextQuestion"
  ],
  "properties": {
    "schemaVersion": { "const": 1 },
    "batchId": { "type": "string", "minLength": 1 },
    "channel": { "const": "CODEX_REQUEST_USER_INPUT" },
    "status": {
      "enum": [
        "IN_PROGRESS",
        "IN_PROGRESS_MODE_INTERRUPTED",
        "AWAITING_BATCH_READBACK",
        "AWAITING_FINAL_CONFIRMATION",
        "CONFIRMED"
      ]
    },
    "updatedAt": { "type": "string", "format": "date-time" },
    "acceptanceStateChanged": { "type": "boolean" },
    "responses": {
      "type": "array",
      "items": {
        "type": "object",
        "required": ["questionId", "decisionId", "optionKey", "optionLabel", "state"],
        "properties": {
          "questionId": { "type": "string" },
          "decisionId": { "type": "string", "pattern": "^D-[0-9]{3}$" },
          "optionKey": { "type": "string" },
          "optionLabel": { "type": "string" },
          "state": {
            "enum": [
              "PENDING_BATCH_READBACK",
              "CONFIRMED_ACCEPTED",
              "CONFIRMED_SPIKE_AUTHORIZED",
              "SUPERSEDED_BY_OWNER_CLARIFICATION"
            ]
          },
          "semantics": { "type": "string" }
        },
        "additionalProperties": false
      }
    },
    "facts": { "type": "array", "items": { "type": "object" } },
    "conflicts": { "type": "array", "items": { "type": "object" } },
    "nextQuestion": {
      "type": "object",
      "required": ["id", "title", "tool"],
      "properties": {
        "id": { "type": "string", "minLength": 1 },
        "title": { "type": "string", "minLength": 1 },
        "tool": { "const": "request_user_input" }
      },
      "additionalProperties": false
    }
  },
  "additionalProperties": false
}
